Headline,Risk,Sector,Link,Timestamp
⚠️ Emerging Trend: AFTER AUCTION,30,Uncategorized,#,
⚠️ Emerging Trend: DEATH TOLL,60,Uncategorized,https://www.google.com/search?q=death+toll+Sri+Lanka+News,2025-11-29 00:01:26
Death toll climbs to 69 after landslides and severe floods in Sri Lanka,25,Environmental,http://www.adaderana.lk/news.php?nid=115293,2025-11-29 00:01:24
PM Harini briefs diplomatic community on flood relief and recovery efforts,25,Environmental,http://www.adaderana.lk/news.php?nid=115290,2025-11-29 00:01:24
Death toll rise to 69 in Sri Lanka’s worst floods in 8 years as Ditwah prevails,30,Environmental,https://economynext.com/death-toll-rise-to-69-in-sri-lankas-worst-floods-in-8-years-as-ditwah-prevails-250574/,2025-11-29 00:01:26
